metric_definition_id	metric_name	display_name	function_code	subfunction_code	category_code	type_code	composition_code	direction_code	industry_code	formula_hint	status_code	maturity_code	description_text	tags	created_by_name	updated_by_name	created_at	updated_at	metric_seq	industry_category_code	seed_ref	verification_result_code	verification_evidence_id	purpose_code	shape_code	temporality_code	precision_code	impact_code	shape_params_json	needs_revalidation	locked_by	locked_at	discipline_code	readiness_min_snapshots	readiness_max_freshness_days	temporality_kind
d61bd0fe-67f7-48bb-a715-8e4e3271f2e6	property_plant_and_equipment_growth_rate	Property, Plant, and Equipment Growth Rate	finance	fixed_assets	\N	\N	primary	higher_is_better	\N	\N	draft	enriched	The percentage growth of PPE from one period to the next, reflecting the company's investment in tangible operational assets.	{}	\N	\N	2026-04-04 09:39:27.203121+00	2026-04-17 09:53:08.242472+00	5971	\N	property_plant_and_equipment_growth_rate	green	\N	performance	scalar	period	final	financial	\N	f	\N	\N	close_and_control	\N	\N	\N
f426c2ed-ffd5-4963-9c4d-2c643c14a958	property_tax_assessment_accuracy	Property Tax Assessment Accuracy	finance	tax	\N	\N	primary	higher_is_better	\N	\N	draft	enriched	The accuracy of property tax assessments compared to fair market values, minimizing the risk of overpayment.	{}	\N	\N	2026-04-04 09:39:22.975953+00	2026-04-17 09:53:08.242472+00	5765	\N	property_tax_assessment_accuracy	green	\N	operational	scalar	period	final	quality	\N	f	\N	\N	close_and_control	\N	\N	\N
2930efc2-fba5-4e8f-8dd1-82cc08ba533c	r_d_tax_credit_utilization	R&D Tax Credit Utilization	finance	tax	\N	\N	primary	higher_is_better	\N	\N	draft	enriched	The extent to which a company effectively utilizes research and development tax credits to reduce its tax liability.	{}	\N	\N	2026-04-04 09:39:22.501763+00	2026-04-17 09:53:08.242472+00	5736	\N	r_d_tax_credit_utilization	green	\N	efficiency	scalar	period	final	financial	\N	f	\N	\N	close_and_control	\N	\N	\N
24941a20-a9ed-47fd-a770-a5bef0850ccf	system_security	System Security	finance	financial_systems	\N	\N	primary	higher_is_better	\N	\N	draft	enriched	The effectiveness of financial systems security measures. It measures the percentage of security incidents related to financial systems.	{}	\N	\N	2026-04-04 09:39:23.302107+00	2026-04-17 09:53:08.242472+00	5774	\N	system_security	green	\N	diagnostic	scalar	period	final	risk	\N	f	\N	\N	close_and_control	\N	\N	\N
acfc95d1-7382-426a-8e78-50234ebf378a	user_satisfaction	User Satisfaction	finance	financial_systems	\N	\N	primary	higher_is_better	\N	\N	draft	enriched	User satisfaction with financial systems. It measures the percentage of users who are satisfied with financial systems and the overall user experience.	{}	\N	\N	2026-04-04 09:39:23.357973+00	2026-04-17 09:53:08.242472+00	5777	\N	user_satisfaction	green	\N	performance	scalar	period	final	satisfaction	\N	f	\N	\N	close_and_control	\N	\N	\N
197a09b6-fa0d-41bd-b643-dbd131dc1a3d	data_accuracy	Data Accuracy	finance	financial_systems	\N	\N	primary	higher_is_better	\N	\N	draft	enriched	The accuracy of data within financial systems. It measures the percentage of data that is accurate and error-free.	{}	\N	\N	2026-04-04 09:39:23.323027+00	2026-04-17 09:53:08.242472+00	5775	\N	data_accuracy	green	\N	operational	scalar	period	final	quality	\N	f	\N	\N	close_and_control	\N	\N	\N
9e1452ee-26d3-4855-9fa5-12c42e999426	financial_system_adoption	Financial System Adoption	finance	financial_systems	\N	\N	primary	higher_is_better	\N	\N	draft	enriched	The adoption rate of financial systems by end-users. It measures the percentage of end-users who are using financial systems compared to the total number of end-users.	{}	\N	\N	2026-04-04 09:39:23.37439+00	2026-04-17 09:53:08.242472+00	5778	\N	financial_system_adoption	green	\N	operational	scalar	period	final	satisfaction	\N	f	\N	\N	close_and_control	\N	\N	\N
06c9a86c-38ab-4fa8-8555-fb9e29c344a9	financial_transactions_verified	Financial Transactions Verified	finance	financial_systems	\N	\N	primary	higher_is_better	\N	\N	draft	enriched	The proportion of financial transactions that are verified for accuracy and authenticity.	{}	\N	\N	2026-04-04 09:39:23.633859+00	2026-04-17 09:53:08.242472+00	5793	\N	percentage_of_financial_transactions_verified	green	\N	operational	scalar	period	final	quality	\N	f	\N	\N	close_and_control	\N	\N	\N
a9ae0f4c-4b13-4264-ae9a-f976381c8f00	frequency_of_financial_system_upgrades	Frequency of Financial System Upgrades	finance	financial_systems	\N	\N	primary	higher_is_better	\N	\N	draft	enriched	The rate at which financial system upgrades are implemented to improve functionality or security.	{}	\N	\N	2026-04-04 09:39:23.680201+00	2026-04-17 09:53:08.242472+00	5796	\N	frequency_of_financial_system_upgrades	green	\N	operational	scalar	period	final	quality	\N	f	\N	\N	close_and_control	\N	\N	\N
8adabdf3-99d8-4e14-a724-c161a2f2bb6d	green_tax_credits_utilization	Green Tax Credits Utilization	finance	tax	\N	\N	primary	higher_is_better	\N	\N	draft	enriched	The extent to which a company utilizes available green or environmental tax credits to offset tax liabilities while supporting sustainability initiatives.	{}	\N	\N	2026-04-04 09:39:22.939551+00	2026-04-17 09:53:08.242472+00	5763	\N	green_tax_credits_utilization	green	\N	efficiency	scalar	period	final	financial	\N	f	\N	\N	close_and_control	\N	\N	\N
ec9f1bef-9c7d-4d3e-999a-80ab4e253f93	real_time_financial_data	Real-Time Financial Data	finance	financial_systems	\N	\N	primary	higher_is_better	\N	\N	draft	enriched	The proportion of financial data available in real-time, enabling timely and informed decision-making.	{}	\N	\N	2026-04-04 09:39:23.585349+00	2026-04-17 09:53:08.242472+00	5790	\N	percentage_of_real_time_financial_data	green	\N	operational	scalar	period	final	time	\N	f	\N	\N	close_and_control	\N	\N	\N
a91dd60d-b921-4472-8ed2-0d6c3f7ace2a	tax_authority_audit_frequency	Tax Authority Audit Frequency	finance	tax	\N	\N	primary	higher_is_better	\N	\N	draft	enriched	The frequency with which the company is audited by tax authorities, which can indicate the perceived risk level of the company's tax positions.	{}	\N	\N	2026-04-04 09:39:22.828414+00	2026-04-17 09:53:08.242472+00	5757	\N	tax_authority_audit_frequency	green	\N	operational	scalar	period	final	risk	\N	f	\N	\N	close_and_control	\N	\N	\N
a8374d07-7086-401a-ad81-32ad5f10f605	tax_compliance_overhead_cost	Tax Compliance Overhead Cost	finance	tax	\N	\N	primary	higher_is_better	\N	\N	draft	enriched	The total administrative cost associated with ensuring tax compliance, including personnel, software, and external advisory expenses.	{}	\N	\N	2026-04-04 09:39:22.473217+00	2026-04-17 09:53:08.242472+00	5734	\N	tax_compliance_overhead_cost	green	\N	efficiency	scalar	period	final	financial	\N	f	\N	\N	close_and_control	\N	\N	\N
522a5d54-69e2-4d9e-8794-341aeba54c30	tax_controversy_resolution_time	Tax Controversy Resolution Time	finance	tax	\N	\N	primary	higher_is_better	\N	\N	draft	enriched	The average time taken to resolve tax controversies, from audit notification to the final resolution.	{}	\N	\N	2026-04-04 09:39:22.686938+00	2026-04-17 09:53:08.242472+00	5748	\N	tax_controversy_resolution_time	green	\N	efficiency	scalar	period	final	time	\N	f	\N	\N	close_and_control	\N	\N	\N
a4af5a7c-2c8f-490f-ab4c-11af3617be4c	tax_dispute_resolution_rate	Tax Dispute Resolution Rate	finance	tax	\N	\N	primary	higher_is_better	\N	\N	draft	enriched	The percentage of tax disputes resolved favorably for the company, indicating the effectiveness of the tax function's negotiation and litigation strategies.	{}	\N	\N	2026-04-04 09:39:22.548963+00	2026-04-17 09:53:08.242472+00	5739	\N	tax_dispute_resolution_rate	green	\N	performance	scalar	period	final	risk	\N	f	\N	\N	close_and_control	\N	\N	\N
474301ad-5e19-469b-9212-51e02d0d024e	tax_function_cost_to_savings_ratio	Tax Function Cost-to-Savings Ratio	finance	tax	\N	\N	primary	higher_is_better	\N	\N	draft	enriched	The ratio of the tax department's operational cost to the tax savings it generates, indicating cost-effectiveness.	{}	\N	\N	2026-04-04 09:39:22.729976+00	2026-04-17 09:53:08.242472+00	5751	\N	tax_function_cost_to_savings_ratio	green	\N	efficiency	scalar	period	final	financial	\N	f	\N	\N	close_and_control	\N	\N	\N
1823b9f3-a9e3-4137-a06f-d1fc139731c0	tax_process_digitalization_level	Tax Process Digitalization Level	finance	tax	\N	\N	primary	higher_is_better	\N	\N	draft	enriched	A measure of the extent to which tax-related processes are digitalized, indicating efficiency and modernization in tax management.	{}	\N	\N	2026-04-04 09:39:23.074548+00	2026-04-17 09:53:08.242472+00	5771	\N	tax_process_digitalization_level	green	\N	operational	scalar	period	final	time	\N	f	\N	\N	close_and_control	\N	\N	\N
feddea6f-f398-4a53-9b19-07affb0912e1	transaction_volume_capacity	Transaction Volume Capacity	finance	financial_systems	\N	\N	primary	higher_is_better	\N	\N	draft	enriched	The maximum number of financial transactions that can be processed within a given timeframe without compromising system performance.	{}	\N	\N	2026-04-04 09:39:23.469436+00	2026-04-17 09:53:08.242472+00	5784	\N	transaction_volume_capacity	green	\N	operational	scalar	period	final	volume	\N	f	\N	\N	close_and_control	\N	\N	\N
e3fd70c7-fd37-4863-9fe3-381d9a3b562b	permanent_establishment_risk_management	Permanent Establishment Risk Management	finance	tax	\N	\N	primary	higher_is_better	\N	\N	deprecated	classified	The management of activities to minimize the risk of creating a taxable presence or permanent establishment in foreign jurisdictions.	{}	\N	\N	2026-04-04 09:39:22.572538+00	2026-04-17 09:53:08.242472+00	5740	\N	permanent_establishment_risk_management	green	\N	operational	scalar	period	final	risk	\N	f	\N	\N	close_and_control	\N	\N	\N
eb3983fc-07a9-417f-ac8c-1b272f8a2175	tax_code_change_adaptability	Tax Code Change Adaptability	finance	tax	\N	\N	primary	higher_is_better	\N	\N	draft	enriched	The company's ability to adapt to tax code changes promptly, minimizing compliance risks and capturing potential benefits.	{}	\N	\N	2026-04-04 09:39:23.044591+00	2026-04-17 09:53:08.242472+00	5769	\N	tax_code_change_adaptability	green	\N	diagnostic	scalar	period	final	compliance	\N	f	\N	\N	close_and_control	\N	\N	\N
81424936-aae9-46dc-8eb0-1358ffea4d9a	tax_data_analytics_utilization	Tax Data Analytics Utilization	finance	tax	\N	\N	primary	higher_is_better	\N	\N	draft	enriched	The extent to which data analytics tools are used to enhance tax function decision-making and risk assessment.	{}	\N	\N	2026-04-04 09:39:22.614851+00	2026-04-17 09:53:08.242472+00	5743	\N	tax_data_analytics_utilization	green	\N	operational	scalar	period	final	quality	\N	f	\N	\N	close_and_control	\N	\N	\N
9d07cafe-336f-46c5-90b9-e3d03a73a046	tax_function_strategic_alignment	Tax Function Strategic Alignment	finance	tax	\N	\N	primary	higher_is_better	\N	\N	draft	enriched	The alignment of the tax function's objectives and activities with the broader strategic goals of the company.	{}	\N	\N	2026-04-04 09:39:22.866714+00	2026-04-17 09:53:08.242472+00	5759	\N	tax_function_strategic_alignment	green	\N	performance	scalar	period	final	quality	\N	f	\N	\N	close_and_control	\N	\N	\N
6ea2e5ae-2b1b-464a-a6b1-5e0972b9ffea	error_rate_in_financial_reports	Error Rate in Financial Reports	finance	financial_systems	\N	\N	primary	higher_is_better	\N	\N	draft	enriched	The percentage of errors found in financial reports, indicating the accuracy and reliability of financial data presented.	{}	\N	\N	2026-04-04 09:39:23.388876+00	2026-04-17 09:53:08.242472+00	5779	\N	error_rate_in_financial_reports	green	\N	operational	scalar	period	final	quality	\N	f	\N	\N	close_and_control	\N	\N	\N
49bc0a19-67ab-4351-83c9-4426b2786864	financial_data_extraction_time	Financial Data Extraction Time	finance	financial_systems	\N	\N	primary	higher_is_better	\N	\N	draft	enriched	The amount of time required to extract financial data from the system for reporting or analysis purposes.	{}	\N	\N	2026-04-04 09:39:23.782811+00	2026-04-17 09:53:08.242472+00	5803	\N	financial_data_extraction_time	green	\N	efficiency	scalar	period	final	time	\N	f	\N	\N	close_and_control	\N	\N	\N
30bbae7d-71a7-4039-910b-21653246d198	financial_data_historical_availability	Financial Data Historical Availability	finance	financial_systems	\N	\N	primary	higher_is_better	\N	\N	draft	enriched	The extent to which historical financial data is accessible for comparison and analysis.	{}	\N	\N	2026-04-04 09:39:23.648666+00	2026-04-17 09:53:08.242472+00	5794	\N	financial_data_historical_availability	green	\N	operational	scalar	period	final	quality	\N	f	\N	\N	close_and_control	\N	\N	\N
e3e1dde2-0ded-4c29-97f1-746e8a7cdb7f	financial_data_reconciliation_time	Financial Data Reconciliation Time	finance	financial_systems	\N	\N	primary	higher_is_better	\N	\N	draft	enriched	The amount of time taken to reconcile financial data across different systems and reports.	{}	\N	\N	2026-04-04 09:39:23.601394+00	2026-04-17 09:53:08.242472+00	5791	\N	financial_data_reconciliation_time	green	\N	efficiency	scalar	period	final	time	\N	f	\N	\N	close_and_control	\N	\N	\N
8336f231-0c8e-41c8-b3d2-e198aca15239	financial_data_storage_utilization	Financial Data Storage Utilization	finance	financial_systems	\N	\N	primary	higher_is_better	\N	\N	draft	enriched	The percentage of available financial data storage capacity that is currently being used.	{}	\N	\N	2026-04-04 09:39:23.738309+00	2026-04-17 09:53:08.242472+00	5800	\N	financial_data_storage_utilization	green	\N	efficiency	scalar	period	final	volume	\N	f	\N	\N	close_and_control	\N	\N	\N
45253264-e348-4b17-9283-5f77a8908421	financial_forecast_accuracy	Financial Forecast Accuracy	finance	financial_systems	\N	\N	primary	higher_is_better	\N	\N	draft	enriched	The degree to which financial forecasts align with actual financial outcomes, indicating the reliability of forecasting models.	{}	\N	\N	2026-04-04 09:39:23.536658+00	2026-04-17 09:53:08.242472+00	5788	\N	financial_forecast_accuracy	green	\N	predictive	scalar	period	final	quality	\N	f	\N	\N	close_and_control	\N	\N	\N
1fc20055-1d0a-4308-8ece-cd4dea24fc72	help_desk_resolution_time	Help Desk Resolution Time	finance	financial_systems	\N	\N	primary	higher_is_better	\N	\N	draft	enriched	The time it takes for help desk tickets related to financial systems to be resolved. It measures the average time it takes for help desk tickets to be resolved from the time they are opened.	{}	\N	\N	2026-04-04 09:39:23.339491+00	2026-04-17 09:53:08.242472+00	5776	\N	help_desk_resolution_time	green	\N	efficiency	scalar	period	final	time	\N	f	\N	\N	close_and_control	\N	\N	\N
99e66a4a-dea6-4ba7-8cab-470ad401c760	intercompany_transactions_compliance	Intercompany Transactions Compliance	finance	tax	\N	\N	primary	higher_is_better	\N	\N	draft	enriched	The level of compliance with tax rules and transfer pricing guidelines for intercompany transactions.	{}	\N	\N	2026-04-04 09:39:22.744167+00	2026-04-17 09:53:08.242472+00	5752	\N	intercompany_transactions_compliance	green	\N	operational	scalar	period	final	compliance	\N	f	\N	\N	close_and_control	\N	\N	\N
3c8ee05f-1678-4d08-a5cc-0abd82f18627	tax_benefit_to_ebitda_ratio	Tax Benefit to EBITDA Ratio	finance	tax	\N	\N	primary	higher_is_better	\N	\N	draft	enriched	The impact of tax strategies on earnings before interest, taxes, depreciation, and amortization (EBITDA), indicating the value added by tax planning.	{}	\N	\N	2026-04-04 09:39:22.845426+00	2026-04-17 09:53:08.242472+00	5758	\N	tax_benefit_to_ebitda_ratio	green	\N	performance	scalar	period	final	financial	\N	f	\N	\N	close_and_control	\N	\N	\N
1ccd8567-cee8-4861-aaa0-11010f8b435f	tax_credits_and_deductions_capture_rate	Tax Credits and Deductions Capture Rate	finance	tax	\N	\N	primary	higher_is_better	\N	\N	draft	enriched	The percentage of all eligible tax credits and deductions that are successfully claimed by the company.	{}	\N	\N	2026-04-04 09:39:22.699363+00	2026-04-17 09:53:08.242472+00	5749	\N	tax_credits_and_deductions_capture_rate	green	\N	performance	scalar	period	final	financial	\N	f	\N	\N	close_and_control	\N	\N	\N
f266319e-d8a8-4386-bda6-ab29d39103eb	tax_department_staff_turnover_rate	Tax Department Staff Turnover Rate	finance	tax	\N	\N	primary	higher_is_better	\N	\N	draft	enriched	The rate at which employees leave the tax department, which can affect continuity and institutional knowledge.	{}	\N	\N	2026-04-04 09:39:22.881802+00	2026-04-17 09:53:08.242472+00	5760	\N	tax_department_staff_turnover_rate	green	\N	operational	scalar	period	final	volume	\N	f	\N	\N	close_and_control	\N	\N	\N
9d3b1367-643f-47f2-9d41-aaf2bba6ebd6	tax_function_training_and_development	Tax Function Training and Development	finance	tax	\N	\N	primary	higher_is_better	\N	\N	draft	enriched	The investment in and effectiveness of training programs for tax department employees to keep them updated on tax laws and best practices.	{}	\N	\N	2026-04-04 09:39:22.658719+00	2026-04-17 09:53:08.242472+00	5746	\N	tax_function_training_and_development	green	\N	operational	scalar	period	final	quality	\N	f	\N	\N	close_and_control	\N	\N	\N
29bee73c-6202-4ce2-a5df-0bc05038a87c	tax_incentives_realization	Tax Incentives Realization	finance	tax	\N	\N	primary	higher_is_better	\N	\N	draft	enriched	The measure of how well a company identifies and capitalizes on available tax incentives to minimize tax expenses.	{}	\N	\N	2026-04-04 09:39:22.515602+00	2026-04-17 09:53:08.242472+00	5737	\N	tax_incentives_realization	green	\N	performance	scalar	period	final	financial	\N	f	\N	\N	close_and_control	\N	\N	\N
2d1b8ec6-8ad7-473a-b979-4a0267c3c38f	tax_litigation_avoidance_ratio	Tax Litigation Avoidance Ratio	finance	tax	\N	\N	primary	higher_is_better	\N	\N	draft	enriched	The ratio of potential tax litigations avoided to those that proceed to court, indicating the effectiveness of proactive tax risk management.	{}	\N	\N	2026-04-04 09:39:22.773438+00	2026-04-17 09:53:08.242472+00	5754	\N	tax_litigation_avoidance_ratio	green	\N	performance	scalar	period	final	risk	\N	f	\N	\N	close_and_control	\N	\N	\N
0d3c96bb-906a-49f3-97e0-ccc441cd5000	country_by_country_reporting_compliance	Country-by-Country Reporting Compliance	finance	tax	\N	\N	primary	higher_is_better	\N	\N	draft	enriched	The compliance with country-by-country reporting requirements that are part of the Base Erosion and Profit Shifting (BEPS) initiative.	{}	\N	\N	2026-04-04 09:39:22.905662+00	2026-04-17 09:53:08.242472+00	5761	\N	country_by_country_reporting_compliance	green	\N	operational	scalar	period	final	compliance	\N	f	\N	\N	close_and_control	\N	\N	\N
5dc39703-30c5-4721-920e-0b8fc8db61b4	excise_tax_management_efficiency	Excise Tax Management Efficiency	finance	tax	\N	\N	primary	higher_is_better	\N	\N	draft	enriched	The efficiency of managing and reporting excise taxes, often applied to specific goods or services.	{}	\N	\N	2026-04-04 09:39:23.007854+00	2026-04-17 09:53:08.242472+00	5767	\N	excise_tax_management_efficiency	green	\N	efficiency	scalar	period	final	financial	\N	f	\N	\N	close_and_control	\N	\N	\N
dd3bb0bf-5d2e-4034-8a37-3b9a33728bd1	financial_system_scalability_index	Financial System Scalability Index	finance	financial_systems	\N	\N	primary	higher_is_better	\N	\N	draft	enriched	A measure of how well financial systems can accommodate growth in transaction volumes or user demands without performance degradation.	{}	\N	\N	2026-04-04 09:39:23.692871+00	2026-04-17 09:53:08.242472+00	5797	\N	financial_system_scalability_index	green	\N	operational	scalar	period	final	volume	\N	f	\N	\N	close_and_control	\N	\N	\N
181ddfff-1ed3-40cd-bd44-1b69ac39d484	tax_communication_effectiveness	Tax Communication Effectiveness	finance	tax	\N	\N	primary	higher_is_better	\N	\N	draft	enriched	The effectiveness of the tax department's communication with internal and external stakeholders regarding tax matters and positions.	{}	\N	\N	2026-04-04 09:39:22.960095+00	2026-04-17 09:53:08.242472+00	5764	\N	tax_communication_effectiveness	green	\N	diagnostic	scalar	period	final	quality	\N	f	\N	\N	close_and_control	\N	\N	\N
a2f85e6c-3de1-49cb-b038-06ab21ea1123	customer_billing_accuracy_rate	Customer Billing Accuracy Rate	finance	financial_systems	\N	\N	primary	higher_is_better	\N	\N	draft	enriched	The accuracy rate of bills sent to customers, which impacts customer satisfaction and financial integrity.	{}	\N	\N	2026-04-04 09:39:23.753814+00	2026-04-17 09:53:08.242472+00	5801	\N	customer_billing_accuracy_rate	green	\N	operational	scalar	period	final	quality	\N	f	\N	\N	close_and_control	\N	\N	\N
2e346722-6b85-4f55-a8b0-5cc03e43c131	data_processing_time	Data Processing Time	finance	financial_systems	\N	\N	primary	higher_is_better	\N	\N	draft	enriched	The time it takes to process financial transactions within financial systems. It measures the average time it takes for financial transactions to be processed and recorded.	{}	\N	\N	2026-04-04 09:39:24.063277+00	2026-04-17 09:53:08.242472+00	5821	\N	data_processing_time	green	\N	efficiency	scalar	period	final	time	\N	f	\N	\N	close_and_control	\N	\N	\N
ea97b097-a5cf-48f8-8e42-3f8e3bf0dc63	financial_transaction_error_detection_rate	Financial Transaction Error Detection Rate	finance	financial_systems	\N	\N	primary	higher_is_better	\N	\N	draft	enriched	The effectiveness of the system in detecting and alerting errors in financial transactions.	{}	\N	\N	2026-04-04 09:39:23.870164+00	2026-04-17 09:53:08.242472+00	5809	\N	financial_transaction_error_detection_rate	green	\N	operational	scalar	period	final	quality	\N	f	\N	\N	close_and_control	\N	\N	\N
59b24905-1fc9-4d75-b91b-d4cfd9fd1b80	invoice_processing_accuracy	Invoice Processing Accuracy	finance	financial_systems	\N	\N	primary	higher_is_better	\N	\N	draft	enriched	The percentage of invoices processed without errors, reflecting the effectiveness of the invoice management system.	{}	\N	\N	2026-04-04 09:39:23.484865+00	2026-04-17 09:53:08.242472+00	5785	\N	invoice_processing_accuracy	green	\N	operational	scalar	period	final	quality	\N	f	\N	\N	close_and_control	\N	\N	\N
3fb00986-47aa-49f7-8af4-b175d138073c	paperless_financial_transactions	Paperless Financial Transactions	finance	financial_systems	\N	\N	primary	higher_is_better	\N	\N	draft	enriched	The proportion of financial transactions completed electronically, reducing paper usage and promoting environmental sustainability.	{}	\N	\N	2026-04-04 09:39:23.974553+00	2026-04-17 09:53:08.242472+00	5816	\N	percentage_of_paperless_financial_transactions	green	\N	efficiency	scalar	period	final	quality	\N	f	\N	\N	close_and_control	\N	\N	\N
7ab37fc7-db74-4c90-a92d-928daa5b6e83	training_hours_per_user_for_financial_systems	Training Hours per User for Financial Systems	finance	financial_systems	\N	\N	primary	higher_is_better	\N	\N	draft	enriched	The average number of training hours each user spends learning to operate the financial systems effectively.	{}	\N	\N	2026-04-04 09:39:23.955879+00	2026-04-17 09:53:08.242472+00	5815	\N	training_hours_per_user_for_financial_systems	green	\N	efficiency	scalar	period	final	time	\N	f	\N	\N	close_and_control	\N	\N	\N
f2648348-feaf-424b-afb6-9378217151b6	user_error_rate_in_financial_systems	User Error Rate in Financial Systems	finance	financial_systems	\N	\N	primary	higher_is_better	\N	\N	draft	enriched	The percentage of errors made by users within financial systems, indicating the need for better training or system improvements.	{}	\N	\N	2026-04-04 09:39:23.705962+00	2026-04-17 09:53:08.242472+00	5798	\N	user_error_rate_in_financial_systems	green	\N	operational	scalar	period	final	quality	\N	f	\N	\N	close_and_control	\N	\N	\N
d6d95262-19f2-4943-942a-86fe66ef2f8c	workflow_efficiency	Workflow Efficiency	finance	financial_systems	\N	\N	primary	higher_is_better	\N	\N	draft	enriched	The efficiency of financial systems workflows. It measures the percentage of workflows that are completed within the expected time frame.	{}	\N	\N	2026-04-04 09:39:23.915966+00	2026-04-17 09:53:08.242472+00	5812	\N	workflow_efficiency	green	\N	efficiency	scalar	period	final	time	\N	f	\N	\N	close_and_control	\N	\N	\N
5091046a-526e-4c0c-a255-b84281b67fca	user_friendly_financial_system_index	User-Friendly Financial System Index	finance	financial_systems	\N	\N	primary	higher_is_better	\N	\N	draft	enriched	A measure of the user-friendliness of financial systems based on user feedback, indicating the ease of use and accessibility of financial systems.	{}	\N	\N	2026-04-04 09:39:24.012551+00	2026-04-17 09:53:08.242472+00	5818	\N	user_friendly_financial_system_index	green	\N	performance	scalar	period	final	satisfaction	\N	f	\N	\N	close_and_control	\N	\N	\N
d9ad4a1e-2979-4bda-a580-0dbb937605a2	cost_of_financial_system_maintenance	Cost of Financial System Maintenance	finance	financial_systems	\N	\N	primary	higher_is_better	\N	\N	draft	enriched	The total expenses incurred in maintaining and updating financial systems to ensure smooth operations.	{}	\N	\N	2026-04-04 09:39:24.085174+00	2026-04-17 09:53:08.242472+00	5822	\N	cost_of_financial_system_maintenance	green	\N	efficiency	scalar	period	final	financial	\N	f	\N	\N	close_and_control	\N	\N	\N
fdf92095-5f72-4dac-97a8-34763f6745fa	financial_reports_generated_on_time	Financial Reports Generated On-Time	finance	financial_systems	\N	\N	primary	higher_is_better	\N	\N	draft	enriched	The proportion of financial reports that are completed and delivered within the established deadlines.	{}	\N	\N	2026-04-04 09:39:23.841276+00	2026-04-17 09:53:08.242472+00	5807	\N	percentage_of_financial_reports_generated_on_time	green	\N	operational	scalar	period	final	time	\N	f	\N	\N	close_and_control	\N	\N	\N
