metric_definition_id	metric_name	display_name	function_code	subfunction_code	category_code	type_code	composition_code	direction_code	industry_code	formula_hint	status_code	maturity_code	description_text	tags	created_by_name	updated_by_name	created_at	updated_at	metric_seq	industry_category_code	seed_ref	verification_result_code	verification_evidence_id	purpose_code	shape_code	temporality_code	precision_code	impact_code	shape_params_json	needs_revalidation	locked_by	locked_at	discipline_code	readiness_min_snapshots	readiness_max_freshness_days	temporality_kind
f5b8ffe5-6667-46bb-bbf7-7dc89f670f06	invoice_delivery_time	Invoice Delivery Time	finance	accounts_receivable	\N	\N	primary	lower_is_better	universal	\N	draft	enriched	Measures the average elapsed time from when a sale or service is completed to when the corresponding invoice is delivered to the customer. Delayed invoice delivery directly extends DSO by pushing the payment clock start date later.	{}	\N	\N	2026-04-04 08:45:27.107462+00	2026-04-17 09:53:08.242472+00	5016	universal	invoice_delivery_time	green	agent-claude-opus	efficiency	scalar	period	final	time	\N	f	\N	\N	working_capital	\N	\N	\N
6d76269a-a922-47ac-bbea-2c10986f36ac	blanket_code_approval_rate	Blanket Code Approval Rate	finance	accounts_payable	\N	\N	primary	higher_is_better	\N	\N	draft	enriched	Percentage of invoice line items approved by pre-approved blanket codes.	{}	\N	\N	2026-04-04 09:28:50.003421+00	2026-04-17 09:53:08.242472+00	5095	\N	percentage_of_invoice_line_items_approved_by_pre_approved_blanket_codes	green	\N	efficiency	scalar	period	final	quality	\N	f	\N	\N	working_capital	\N	\N	\N
45b02c62-8866-411b-866c-511ef8d138c4	blocked_invoices_value	Blocked Invoices Value	finance	accounts_payable	\N	\N	primary	lower_is_better	\N	\N	draft	enriched	Total monetary value of invoices currently blocked from payment.	{}	\N	\N	2026-04-04 09:28:50.003421+00	2026-04-17 09:53:08.242472+00	5111	\N	blocked_invoices_value	green	\N	operational	scalar	period	final	financial	\N	f	\N	\N	working_capital	\N	\N	\N
a11d4074-8a85-4303-b07f-67434a5b197b	invoice_exception_resolution_time	Invoice Exception Resolution Time	finance	accounts_payable	\N	\N	primary	lower_is_better	\N	\N	draft	enriched	Average working days from invoice exception detection to resolution.	{}	\N	\N	2026-04-04 09:28:50.003421+00	2026-04-17 09:53:08.242472+00	5113	\N	average_cycle_time_in_working_days_from_when_an_invoice_exception_is_detected_to_when_the_exception_is_resolved	green	\N	efficiency	scalar	period	final	time	\N	f	\N	\N	working_capital	\N	\N	\N
25f3d69e-ee72-43c0-9612-1bcb56e8572c	invoice_dispute_rate	Invoice Dispute Rate	finance	accounts_receivable	\N	\N	primary	lower_is_better	universal	\N	draft	enriched	Measures the percentage of invoices that are formally disputed by customers. Disputes are the primary driver of delayed payments and DSO inflation, and a high dispute rate signals systemic issues in pricing, contract compliance, order fulfillment, or billing accuracy.	{}	\N	\N	2026-04-04 08:45:27.12022+00	2026-04-17 09:53:08.242472+00	5017	universal	invoice_dispute_rate	green	agent-claude-opus	diagnostic	scalar	period	final	quality	\N	f	\N	\N	working_capital	\N	\N	\N
1ae5eca9-dc09-4aa5-aefd-6718b18a537d	customer_payment_performance_score	Customer Payment Performance Score	finance	accounts_receivable	\N	\N	primary	higher_is_better	universal	\N	draft	enriched	A composite score evaluating a customer's payment behavior based on historical timeliness, consistency, dispute frequency, and payment method. It serves as an internal credit behavior rating that complements external credit scores.	{}	\N	\N	2026-04-04 08:45:26.84368+00	2026-04-17 09:53:08.242472+00	5001	universal	customer_payment_performance_score	green	agent-claude-opus	performance	scalar	period	final	financial	\N	f	\N	\N	working_capital	\N	\N	\N
8e11d258-dcb4-4c7d-b599-eb2cb394183c	doubtful_debt_provision	Doubtful Debt Provision	finance	accounts_receivable	\N	\N	primary	lower_is_better	universal	\N	draft	enriched	The monetary amount set aside as a provision for accounts receivable estimated to be uncollectible. Under IFRS 9 and ASC 326, this represents the expected credit loss (ECL) calculation applied to the AR portfolio, impacting both the balance sheet (contra-asset) and income statement (bad debt expense).	{}	\N	\N	2026-04-04 08:45:27.286135+00	2026-04-17 09:53:08.242472+00	5029	universal	provision_for_doubtful_debts	green	agent-claude-opus	predictive	scalar	period	final	financial	\N	f	\N	\N	working_capital	\N	\N	\N
11151f6e-0650-4d61-a9ea-6999fe7e5206	duplicate_invoice_detection_count	Duplicate Invoice Detection Count	finance	accounts_payable	\N	\N	primary	lower_is_better	\N	\N	draft	enriched	Number of potential duplicate invoices detected.	{}	\N	\N	2026-04-04 09:28:50.003421+00	2026-04-17 09:53:08.242472+00	5115	\N	duplicate_invoice_detection_count	green	\N	operational	scalar	period	final	volume	\N	f	\N	\N	working_capital	\N	\N	\N
3d3a7dd0-88ed-4bb8-b69b-7cf842777a1e	fraud_detection_rate	Fraud Detection Rate	finance	accounts_payable	\N	\N	primary	higher_is_better	\N	\N	draft	enriched	Rate at which fraudulent invoices or payments are detected and prevented.	{}	\N	\N	2026-04-04 09:28:50.003421+00	2026-04-17 09:53:08.242472+00	5119	\N	fraud_detection_rate	green	\N	performance	scalar	period	final	risk	\N	f	\N	\N	working_capital	\N	\N	\N
2f18a131-090d-40d7-b90e-acf779eba937	internal_ap_query_resolution_time	Internal AP Query Resolution Time	finance	accounts_payable	\N	\N	primary	lower_is_better	\N	\N	draft	enriched	Average time to resolve internal AP queries.	{}	\N	\N	2026-04-04 09:28:50.003421+00	2026-04-17 09:53:08.242472+00	5138	\N	internal_ap_query_resolution_time	green	\N	efficiency	scalar	period	final	time	\N	f	\N	\N	working_capital	\N	\N	\N
81af0e57-8f48-4cd9-86d0-eb6290fca50b	invoice_dispute_resolution_count	Invoice Dispute Resolution Count	finance	accounts_payable	\N	\N	primary	higher_is_better	\N	\N	draft	enriched	Number of billing or payment disputes successfully resolved.	{}	\N	\N	2026-04-04 09:28:50.003421+00	2026-04-17 09:53:08.242472+00	5116	\N	number_of_disputes_resolved	green	\N	operational	scalar	period	final	volume	\N	f	\N	\N	working_capital	\N	\N	\N
d0552274-8f39-4957-8c53-0b3700f1f1ae	vendor_concentration_risk	Vendor Concentration Risk	finance	accounts_payable	\N	\N	primary	lower_is_better	\N	\N	draft	enriched	Percentage of total AP spend in top vendors.	{}	\N	\N	2026-04-04 09:28:50.003421+00	2026-04-17 09:53:08.242472+00	5123	\N	vendor_concentration	green	\N	operational	scalar	period	final	risk	\N	f	\N	\N	working_capital	\N	\N	\N
fc03249c-d47f-4578-8b42-1e5c22adc0e1	billing_csat	Billing CSAT	finance	accounts_receivable	\N	\N	primary	higher_is_better	universal	\N	draft	enriched	Measures customer satisfaction specifically with the billing and payment experience, captured through surveys, NPS sub-scores, or feedback channels. Billing friction is a top driver of customer churn in subscription and recurring-revenue businesses.	{}	\N	\N	2026-04-04 08:45:26.882191+00	2026-04-17 09:53:08.242472+00	5003	universal	customer_satisfaction_with_the_billing_and_payment_process	green	agent-claude-opus	performance	scalar	period	final	satisfaction	\N	f	\N	\N	working_capital	\N	\N	\N
248546a7-5bbb-484e-b531-29f038b7f96a	collector_efficiency_score	Collector Efficiency Score	finance	accounts_receivable	\N	\N	primary	higher_is_better	universal	\N	draft	enriched	A weighted composite score evaluating individual collector performance across multiple dimensions: collection amount performance, account coverage, and aging improvement. Enables fair comparison across collectors with different portfolio sizes and risk profiles.	{}	\N	\N	2026-04-04 08:45:26.625513+00	2026-04-17 09:53:08.242472+00	4991	universal	collector_efficiency_score	green	agent-claude-opus	efficiency	scalar	period	final	financial	\N	f	\N	\N	working_capital	\N	\N	\N
e95fe828-ed0d-410d-a976-5d5db47eceec	vendor_dependability_score	Vendor Dependability Score	finance	accounts_payable	\N	\N	primary	higher_is_better	\N	\N	draft	enriched	Measure of vendor reliability in quality, delivery, and service.	{}	\N	\N	2026-04-04 09:28:50.003421+00	2026-04-17 09:53:08.242472+00	5126	\N	vendor_dependability_score	green	\N	performance	scalar	period	final	quality	\N	f	\N	\N	working_capital	\N	\N	\N
0b957bab-4ca9-4009-928c-1d992e7b95d1	past_due_ar_rate	Past Due AR Rate	finance	accounts_receivable	\N	\N	primary	lower_is_better	universal	\N	draft	enriched	Measures the percentage of total accounts receivable that is past its due date. This is a direct measure of collection effectiveness and credit policy health — a rising past-due rate is the clearest signal that cash inflows are at risk.	{}	\N	\N	2026-04-04 08:45:27.177123+00	2026-04-17 09:53:08.242472+00	5021	universal	past_due_balance_percentage	green	agent-claude-opus	operational	scalar	period	final	time	\N	f	\N	\N	working_capital	\N	\N	\N
5cb2c71c-07ac-424e-b96a-cadb7ba67748	revenue_collection_rate	Revenue Collection Rate	finance	accounts_receivable	\N	\N	primary	higher_is_better	universal	\N	active	enriched	Measures the percentage of assessed or invoiced revenue that is actually collected in cash. Unlike DSO which measures timing, collection rate measures completeness — what fraction of billed revenue is ultimately received. A rate below 100% indicates permanent revenue leakage from write-offs, discounts, or uncollectibles.	{}	\N	\N	2026-04-04 08:45:27.331472+00	2026-05-14 10:32:33.183+00	5032	universal	revenue_collection_rate	pass	d8675b71-60c0-4efa-8acf-ace09b8087eb	efficiency	scalar	period	final	financial	\N	f	\N	\N	working_capital	\N	\N	\N
36c02b4c-1892-472d-be3f-5fd005f8131a	payment_delinquency_rate	Payment Delinquency Rate	finance	accounts_receivable	\N	\N	primary	lower_is_better	universal	\N	draft	enriched	Measures the percentage of customer accounts that are overdue on their payments beyond an established threshold (typically 30, 60, or 90 days). Unlike past-due AR rate which measures dollar amounts, delinquency rate counts accounts, revealing the breadth of payment problems across the customer base.	{}	\N	\N	2026-04-04 08:45:27.191925+00	2026-04-17 09:53:08.242472+00	5022	universal	payment_delinquency_rate	green	agent-claude-opus	performance	scalar	period	final	financial	\N	f	\N	\N	working_capital	\N	\N	\N
c5987b82-0dda-4d92-8ba6-abda2c0006ca	unbilled_revenue	Unbilled Revenue	finance	accounts_receivable	\N	\N	primary	lower_is_better	universal	\N	draft	enriched	Measures the total value of revenue that has been recognized per accounting standards but not yet invoiced to customers. Common in project-based, time-and-materials, and milestone-based billing models. Unbilled revenue represents cash that cannot be collected until invoicing occurs, creating a working capital drag.	{}	\N	\N	2026-04-04 08:45:27.415514+00	2026-04-17 09:53:08.242472+00	5040	universal	unbilled_revenue	green	agent-claude-opus	operational	scalar	period	final	financial	\N	f	\N	\N	working_capital	\N	\N	\N
c5b582d9-9a81-4441-8460-95b27a353c5d	goppar	GOPPAR (Gross Operating Profit per Available Room)	finance	accounts_receivable	\N	\N	primary	higher_is_better	universal	\N	draft	enriched	Gross operating profit divided by available rooms. Most comprehensive hotel profitability metric.	{}	\N	\N	2026-04-04 08:47:15.445672+00	2026-04-17 09:53:08.242472+00	5043	services	goppar_gross_operating_profit_per_available_room	green	agent-claude-opus	performance	scalar	period	final	financial	\N	f	\N	\N	working_capital	\N	\N	\N
24a76760-a17b-4f2e-beab-82b0e99c020d	payment_timeliness_pct	Payment Timeliness %	finance	accounts_payable	\N	\N	primary	higher_is_better	\N	\N	draft	enriched	Percentage of payments made on time without incurring late fees.	{}	\N	\N	2026-04-04 09:28:50.003421+00	2026-04-17 09:53:08.242472+00	5067	\N	payment_timeliness	green	\N	performance	scalar	period	final	time	\N	f	\N	\N	working_capital	\N	\N	\N
ca6c8af2-d51a-4373-b61d-cd228ec4b3d5	reversal_credit_note_ratio	Reversal and Credit Note Ratio	finance	accounts_receivable	\N	\N	primary	lower_is_better	universal	\N	draft	enriched	Measures the value of credit notes and revenue reversals as a percentage of gross sales. A high ratio indicates systematic issues with returns, pricing errors, contract non-compliance, or unauthorized discounting that erode gross revenue and complicate revenue recognition.	{}	\N	\N	2026-04-04 08:45:27.343873+00	2026-04-17 09:53:08.242472+00	5033	universal	reversal_credit_note_ratio	green	agent-claude-opus	diagnostic	scalar	period	final	financial	\N	f	\N	\N	working_capital	\N	\N	\N
4ae7de25-4be5-4966-8cce-df5b5bc18ed9	total_ap_balance	Total AP Balance	finance	accounts_payable	\N	\N	primary	lower_is_better	\N	\N	draft	enriched	Aggregate value of all outstanding vendor payables.	{}	\N	\N	2026-04-04 09:28:50.003421+00	2026-04-17 09:53:08.242472+00	5049	\N	total_ap_balance	green	\N	operational	scalar	period	final	financial	\N	f	\N	\N	working_capital	\N	\N	\N
8ca30243-6cb5-4950-b8ce-7d865bf6c5a2	total_ap_transactions	Total AP Transactions	finance	accounts_payable	\N	\N	primary	target_is_optimal	\N	\N	draft	enriched	Total accounts payable transactions processed in a given period.	{}	\N	\N	2026-04-04 09:28:50.003421+00	2026-04-17 09:53:08.242472+00	5064	\N	total_number_of_ap_transactions	green	\N	operational	scalar	period	final	volume	\N	f	\N	\N	working_capital	\N	\N	\N
d0980a74-d1b2-453b-8afc-58cfe227592d	high_risk_ar_exposure	High-Risk AR Exposure	finance	accounts_receivable	\N	\N	primary	lower_is_better	universal	\N	draft	enriched	Measures the total accounts receivable balance attributed to customers classified as high credit risk. This metric quantifies concentration of potential bad debt exposure and drives proactive credit limit adjustments, collection prioritization, and reserve adequacy planning.	{}	\N	\N	2026-04-04 08:45:27.024969+00	2026-04-17 09:53:08.242472+00	5011	universal	high_risk_customer_ar_exposure	green	agent-claude-opus	diagnostic	scalar	period	final	risk	\N	f	\N	\N	working_capital	\N	\N	\N
410098ca-3e2b-4d26-910b-091179e8cd31	trade_vs_non_trade_payables_ratio	Trade vs Non-Trade Payables Ratio	finance	accounts_payable	\N	\N	primary	target_is_optimal	\N	\N	draft	enriched	Ratio of trade payables to non-trade payables (accruals, tax, intercompany).	{}	\N	\N	2026-04-04 09:28:50.003421+00	2026-04-17 09:53:08.242472+00	5053	\N	trade_vs_non_trade_payables_split	green	\N	operational	scalar	period	final	financial	\N	f	\N	\N	working_capital	\N	\N	\N
b3c8dc07-1bfe-42a8-8d79-687a6adf4458	trevpar	TRevPAR (Total Revenue per Available Room)	finance	accounts_receivable	\N	\N	primary	higher_is_better	universal	\N	draft	enriched	All revenue (rooms, F&B, spa, events) divided by available rooms.	{}	\N	\N	2026-04-04 08:47:15.516734+00	2026-04-17 09:53:08.242472+00	5046	services	trevpar_total_revenue_per_available_room	green	agent-claude-opus	performance	scalar	period	final	financial	\N	f	\N	\N	working_capital	\N	\N	\N
f1ad29dd-d112-4d51-a29f-846fdeffe251	invoice_approval_cycle_time	Invoice Approval Cycle Time	finance	accounts_payable	\N	\N	primary	lower_is_better	\N	\N	draft	enriched	Average time from invoice receipt to approval.	{}	\N	\N	2026-04-04 09:28:50.003421+00	2026-04-17 09:53:08.242472+00	5057	\N	invoice_approval_cycle_time	green	\N	efficiency	scalar	period	final	time	\N	f	\N	\N	working_capital	\N	\N	\N
bea10cbd-31b2-4016-9a51-a94f0c7daa4d	invoice_data_entry_cycle_time	Invoice Data Entry Cycle Time	finance	accounts_payable	\N	\N	primary	lower_is_better	\N	\N	draft	enriched	Hours from receipt of invoice until data entered into the system.	{}	\N	\N	2026-04-04 09:28:50.003421+00	2026-04-17 09:53:08.242472+00	5056	\N	cycle_time_in_hours_from_receipt_of_invoice_until_data_entered_into_the_system	green	\N	efficiency	scalar	period	final	time	\N	f	\N	\N	working_capital	\N	\N	\N
c1415bed-bf24-4e97-9a28-87d92b2b262d	invoice_error_resolution_time	Invoice Error Resolution Time	finance	accounts_payable	\N	\N	primary	lower_is_better	\N	\N	draft	enriched	Calendar days from discovering an invoice error to resolution.	{}	\N	\N	2026-04-04 09:28:50.003421+00	2026-04-17 09:53:08.242472+00	5059	\N	cycle_time_in_days_to_resolve_an_invoice_error	green	\N	efficiency	scalar	period	final	time	\N	f	\N	\N	working_capital	\N	\N	\N
c3a64424-57ec-41bd-8eac-288fca624e21	invoice_line_items_per_invoice	Invoice Line Items per Invoice	finance	accounts_payable	\N	\N	primary	target_is_optimal	\N	\N	draft	enriched	Average number of line items per invoice.	{}	\N	\N	2026-04-04 09:28:50.003421+00	2026-04-17 09:53:08.242472+00	5061	\N	average_invoice_line_items_per_invoice	green	\N	operational	scalar	period	final	volume	\N	f	\N	\N	working_capital	\N	\N	\N
3c2c0935-3fd5-4a36-ab04-3d7da6368c8a	invoice_line_items_per_million_revenue	Invoice Line Items per Million Revenue	finance	accounts_payable	\N	\N	primary	lower_is_better	\N	\N	draft	enriched	Number of invoice line items processed per $1M revenue.	{}	\N	\N	2026-04-04 09:28:50.003421+00	2026-04-17 09:53:08.242472+00	5063	\N	number_of_payables_invoice_line_items_processed_per_1_million_revenue	green	\N	efficiency	scalar	period	final	financial	\N	f	\N	\N	working_capital	\N	\N	\N
2c3368a4-2b2b-4631-94c4-3122fb06a82a	audit_scope_adherence	Audit Scope Adherence	finance	internal_audit	\N	\N	primary	higher_is_better	\N	\N	draft	enriched	The degree to which the internal audit adheres to the predefined audit scope, ensuring focused and relevant audit activities.	{}	\N	\N	2026-04-04 09:39:24.924439+00	2026-04-17 09:56:20.876061+00	5862	\N	audit_scope_adherence	green	\N	operational	scalar	period	final	compliance	\N	f	\N	\N	close_and_control	\N	\N	\N
a757cb88-8fb1-4a1b-8ef0-762814077031	audit_team_competency	Audit Team Competency	finance	internal_audit	\N	\N	primary	higher_is_better	\N	\N	draft	enriched	The competency of the internal audit team. It helps ensure that the team has the necessary skills and knowledge to perform audits effectively.	{}	\N	\N	2026-04-04 09:39:24.974838+00	2026-04-17 09:56:20.876061+00	5865	\N	audit_team_competency	green	\N	performance	scalar	period	final	quality	\N	f	\N	\N	close_and_control	\N	\N	\N
4d4e7072-5fdd-4906-99ae-b186d09cacfa	test_of_controls_effectiveness	Test of Controls Effectiveness	finance	internal_audit	\N	\N	primary	higher_is_better	\N	\N	draft	enriched	The effectiveness of internal controls tested during the audit, indicating the reliability of financial reporting and compliance.	{}	\N	\N	2026-04-04 09:39:25.020694+00	2026-04-17 09:56:20.876061+00	5868	\N	test_of_controls_effectiveness	green	\N	performance	scalar	period	final	compliance	\N	f	\N	\N	close_and_control	\N	\N	\N
db6ce89d-c0cc-444d-8edc-b823c3ac182d	invoice_processing_cycle_time	Invoice Processing Cycle Time	finance	accounts_payable	\N	\N	primary	lower_is_better	\N	\N	draft	enriched	Average days from vendor invoice receipt to posting in the AP system.	{}	\N	\N	2026-04-04 09:28:50.003421+00	2026-04-17 09:53:08.242472+00	5054	\N	invoice_processing_cycle_time	green	\N	efficiency	scalar	period	final	time	\N	f	\N	\N	working_capital	\N	\N	\N
b0ede510-8a9b-4e2e-a7ae-420c991e43c3	invoices_per_million_revenue	Invoices per Million Revenue	finance	accounts_payable	\N	\N	primary	lower_is_better	\N	\N	draft	enriched	Number of payables invoices processed per $1M revenue.	{}	\N	\N	2026-04-04 09:28:50.003421+00	2026-04-17 09:53:08.242472+00	5062	\N	number_of_payables_invoices_processed_per_1_million_revenue	green	\N	efficiency	scalar	period	final	financial	\N	f	\N	\N	working_capital	\N	\N	\N
46395544-c325-4322-bfce-d1ebd50d8bde	invoices_processed_per_month	Invoices Processed per Month	finance	accounts_payable	\N	\N	primary	higher_is_better	\N	\N	draft	enriched	Volume of invoices the AP department processes monthly.	{}	\N	\N	2026-04-04 09:28:50.003421+00	2026-04-17 09:53:08.242472+00	5060	\N	number_of_invoices_processed_per_month	green	\N	operational	scalar	period	final	volume	\N	f	\N	\N	working_capital	\N	\N	\N
6abe2837-b950-47dd-bbf9-357a44041a87	manual_urgent_payment_share	Manual/Urgent Payment Share	finance	accounts_payable	\N	\N	primary	lower_is_better	\N	\N	draft	enriched	Percentage of payments processed outside standard payment run.	{}	\N	\N	2026-04-04 09:28:50.003421+00	2026-04-17 09:53:08.242472+00	5071	\N	manual_urgent_payments_share	green	\N	operational	scalar	period	final	time	\N	f	\N	\N	working_capital	\N	\N	\N
d1e0e464-2594-4e3e-9fc9-629d47b3fc7a	missed_discount_pct	Missed Discount %	finance	accounts_payable	\N	\N	primary	lower_is_better	\N	\N	draft	enriched	Percentage of early payment discounts missed.	{}	\N	\N	2026-04-04 09:28:50.003421+00	2026-04-17 09:53:08.242472+00	5080	\N	missed_discounts_percentage	green	\N	efficiency	scalar	period	final	financial	\N	f	\N	\N	working_capital	\N	\N	\N
0e39eea4-9849-4eb0-88f2-a5feab411190	no_po_invoice_rate	No-PO Invoice Rate	finance	accounts_payable	\N	\N	primary	lower_is_better	\N	\N	draft	enriched	Percentage of vendor invoices received without a purchase order.	{}	\N	\N	2026-04-04 09:28:50.003421+00	2026-04-17 09:53:08.242472+00	5086	\N	no_po_invoice_rate	green	\N	operational	scalar	period	final	compliance	\N	f	\N	\N	working_capital	\N	\N	\N
96cdf158-c22d-4ad3-bc5c-e530cddc5b80	payment_accuracy_rate	Payment Accuracy Rate	finance	accounts_payable	\N	\N	primary	higher_is_better	\N	\N	draft	enriched	Percentage of payments made accurately without errors.	{}	\N	\N	2026-04-04 09:28:50.003421+00	2026-04-17 09:53:08.242472+00	5066	\N	payment_accuracy	green	\N	performance	scalar	period	final	quality	\N	f	\N	\N	working_capital	\N	\N	\N
62980f28-3954-4171-9a4e-477e18914b28	payment_on_time_rate	Payment On-Time Rate	finance	accounts_payable	\N	\N	primary	higher_is_better	\N	\N	draft	enriched	Percentage of vendor invoices paid on or before due date.	{}	\N	\N	2026-04-04 09:28:50.003421+00	2026-04-17 09:53:08.242472+00	5065	\N	vendor_on_time_payment_rate	green	\N	performance	scalar	period	final	time	\N	f	\N	\N	working_capital	\N	\N	\N
690fff5a-9f9c-46c2-b5de-bf048c431c79	payment_proposal_timeliness_pct	Payment Proposal Timeliness %	finance	accounts_payable	\N	\N	primary	higher_is_better	\N	\N	draft	enriched	Percentage of payment proposals generated on schedule.	{}	\N	\N	2026-04-04 09:28:50.003421+00	2026-04-17 09:53:08.242472+00	5075	\N	payment_proposal_timeliness	green	\N	performance	scalar	period	final	time	\N	f	\N	\N	working_capital	\N	\N	\N
a291c3ca-c851-43b3-8771-f56f714a87af	audit_data_quality	Audit Data Quality	finance	internal_audit	\N	\N	primary	higher_is_better	\N	\N	draft	enriched	The quality of data used in the audit process, affecting the reliability of audit conclusions.	{}	\N	\N	2026-04-04 09:39:24.782835+00	2026-04-17 09:56:20.876061+00	5853	\N	audit_data_quality	green	\N	operational	scalar	period	final	quality	\N	f	\N	\N	close_and_control	\N	\N	\N
9a26ae99-97c4-402b-b31e-dcec6cc8d2a7	po_invoice_reconciliation_rate	PO-Invoice Reconciliation Rate	finance	accounts_payable	\N	\N	primary	higher_is_better	\N	\N	draft	enriched	Rate at which POs and invoices are reconciled without discrepancies.	{}	\N	\N	2026-04-04 09:28:50.003421+00	2026-04-17 09:53:08.242472+00	5087	\N	po_and_invoice_reconciliation_rate	green	\N	efficiency	scalar	period	final	quality	\N	f	\N	\N	working_capital	\N	\N	\N
3aa0bed4-941f-4d64-b1a4-da64ca829bc7	po_match_rate	PO Match Rate	finance	accounts_payable	\N	\N	primary	higher_is_better	\N	\N	draft	enriched	Percentage of invoice line items matched with a purchase order.	{}	\N	\N	2026-04-04 09:28:50.003421+00	2026-04-17 09:53:08.242472+00	5085	\N	percentage_of_invoice_line_items_matched_with_a_purchase_order	green	\N	efficiency	scalar	period	final	quality	\N	f	\N	\N	working_capital	\N	\N	\N
19b4b3fe-ffd9-419f-ac0c-17ed3e82b776	recurring_payment_pct	Recurring Payment %	finance	accounts_payable	\N	\N	primary	target_is_optimal	\N	\N	draft	enriched	Percentage of total payments that are recurring.	{}	\N	\N	2026-04-04 09:28:50.003421+00	2026-04-17 09:53:08.242472+00	5077	\N	percentage_of_recurring_payments	green	\N	operational	scalar	period	final	financial	\N	f	\N	\N	working_capital	\N	\N	\N
03159ce9-f4fa-4442-b78c-bc981dfc3407	rerti	ReRTI (RevPAR Room Type Index)	finance	accounts_receivable	\N	\N	primary	higher_is_better	universal	\N	draft	enriched	Revenue performance comparison across room categories. Measures yield optimization by room type.	{}	\N	\N	2026-04-04 08:47:15.49202+00	2026-04-17 09:53:08.242472+00	5045	services	rerti_revpar_room_type_index	green	agent-claude-opus	performance	scalar	period	final	financial	\N	f	\N	\N	working_capital	\N	\N	\N
a452ec67-1951-4141-ad0c-2eecaffff328	asset_portfolio_optimization	Asset Portfolio Optimization	finance	iso_55001	\N	\N	primary	higher_is_better	\N	\N	deprecated	classified	The process of adjusting the mix of assets to achieve the best possible financial performance while managing risk and ensuring service delivery.	{}	\N	\N	2026-04-04 09:39:26.242008+00	2026-04-17 09:53:08.242472+00	5918	\N	asset_portfolio_optimization	green	\N	performance	scalar	period	final	financial	\N	f	\N	\N	close_and_control	\N	\N	\N
daac7a42-d5bb-495f-bb73-15e66d23a140	asset_management_governance_effectiveness	Asset Management Governance Effectiveness	finance	iso_55001	\N	\N	primary	higher_is_better	\N	\N	draft	enriched	The effectiveness of governance structures and practices in overseeing and guiding asset management activities.	{}	\N	\N	2026-04-04 09:39:26.457977+00	2026-04-17 09:53:08.242472+00	5933	\N	asset_management_governance_effectiveness	green	\N	performance	scalar	period	final	quality	\N	f	\N	\N	close_and_control	\N	\N	\N
